,course_name,course_link,course_instr,course_rating,coures_reviews,course_totalHourse,course_lectures,course_level,price,price_dis,course_enrollmenters
1466,Tamil Speaking Course | Beginners,https://www.udemy.com/course/tamil-grammar-through-english-beginners/,Aung Myo,4.4,12,5.0,20,All Levels,29.99,11.99,73
1467,"Glider design, Performance and Stability",https://www.udemy.com/course/glider-design-performance-and-stability/,Mohamed Sereez,4.0,12,1.5,8,All Levels,29.99,11.99,64
1468,Efficient Lighting System,https://www.udemy.com/course/efficient-lighting-system/,Dr Sonal Desai,3.9,12,1.0,5,Beginner,109.99,11.99,78
1469,Topics in Algebra: Strategies for Solving Equations,https://www.udemy.com/course/topics-in-algebra-strategies-for-solving-equations/,Joe Huston,4.5,12,3.0,26,Beginner,19.99,11.99,141
1470,Right Mentality for Language Learning,https://www.udemy.com/course/right-mentality/,Fedor Shirin,4.9,12,1.5,10,All Levels,19.99,11.99,35
1471,Crash Course in Portfolio Management Professional (PfMP®),https://www.udemy.com/course/portfolio-management-pfmp/,Sam Ng,3.2,12,1.0,31,All Levels,19.99,11.99,505
1472,Pressure Safety Valve and other Safety Devices,https://www.udemy.com/course/pressure-safety-valve-and-other-safety-devices/,Mohammed Arfaq Ahmed,3.7,12,2.5,10,All Levels,69.99,11.99,51
1473,Physics: from Galileo to Einstein,https://www.udemy.com/course/physics-from-galileo-to-einstein/,Marco Masi,4.5,12,9.0,22,Intermediate,19.99,11.99,519
1474,Efficient Lighting System,https://www.udemy.com/course/efficient-lighting-system/,Dr Sonal Desai,3.9,12,1.0,5,Beginner,109.99,11.99,78
1475,Orthographe et Prononciation de la langue Française,https://www.udemy.com/course/orthographe-prononciation-francais-french/,Christelle Maris,4.8,12,15.0,115,All Levels,129.99,11.99,87
1476,CALCULUS Needed for Physics and Chemistry,https://www.udemy.com/course/calculus-needed-for-physics-and-chemistry/,Anupal Bharali,4.7,12,2.0,18,Beginner,19.99,11.99,45
1477,The Complete College Admissions Adventure,https://www.udemy.com/course/the-complete-college-admissions-adventure/,Alpha Academia - Sarah Ballard,4.3,12,2.5,15,All Levels,99.99,11.99,168
1478,Stop Hackers with 100% Free Plugins!,https://www.udemy.com/course/stop-hackers-with-totally-free-plugins/,Rick Macaulay,4.9,12,1.5,11,Beginner,24.99,11.99,1081
1479,Grade 9 Mathematics from start to finish,https://www.udemy.com/course/grade-9-mathematics/,Lamprecht@Lotter Lötter,3.9,12,12.5,107,All Levels,109.99,11.99,48
1480,German For absolute Beginners,https://www.udemy.com/course/german-for-absolute-beginners-comprehensive-course/,Anees Thabet,4.5,12,2.0,34,Beginner,19.99,11.99,102
1481,Master the basics of Organic Chemistry ,https://www.udemy.com/course/basicorgo/,Luth Faris,4.4,12,1.5,21,Beginner,19.99,11.99,105
1482,Introduction to Online Learning Development and Support,https://www.udemy.com/course/introduction-to-online-learning-development-and-support/,John Vivolo,4.1,12,1.5,14,Beginner,34.99,11.99,41
1483,Getting Started: Learning to Write Creative Non Fiction,https://www.udemy.com/course/writing-creative-non-fiction/,LectureWare ™,3.4,12,27.0,17,Beginner,19.99,11.99,45
1484,Warp Drive Physics: Prepare for Warp Speed,https://www.udemy.com/course/warp-drive-physics/,"Gilad James, PhD",4.1,12,1.5,20,Intermediate,19.99,11.99,283
1485,Learn Chinese from Scratch!,https://www.udemy.com/course/learn-chinese-from-scratch/,Xiating Cai,4.7,12,1.0,10,Beginner,29.99,11.99,896
1486,SAT Video Training: 15 Lessons to Master SAT Strategy,https://www.udemy.com/course/free-sat-class/,Craig Anthony,3.9,12,1.0,24,All Levels,19.99,11.99,2877
1487,Grammar to Speak: Pre-intermediate,https://www.udemy.com/course/english-grammar-to-speak-pre-intermediate/,Parham Marezlou,4.1,12,2.0,22,Intermediate,19.99,11.99,0
1488,English idioms you must know 2,https://www.udemy.com/course/english-idiom2/,Ahmad Rabiee,4.8,11,2.0,37,Intermediate,29.99,11.99,1312
1489,Making Teaching Easy & Innovative,https://www.udemy.com/course/making-teaching-easy-innovative/,Dr. Dheeraj Mehrotra,3.7,11,2.0,19,All Levels,19.99,11.99,0
1490,SASL 101: South African Sign Language for beginners,https://www.udemy.com/course/sasl-101-south-african-sign-language-for-beginners/,Karabo Mogonwe,3.9,11,1.0,29,Beginner,24.99,11.99,87
1491,StudiGuide 5: Introduction to California Criminal Law,https://www.udemy.com/course/studiguide-5-introduction-to-california-criminal-law/,Michael Rubacha,4.7,11,30.0,16,All Levels,19.99,11.99,77
1492,"How to read Quran in Tajweed, Quranic Arabic Course",https://www.udemy.com/course/learn-how-to-read-quran-properly-from-scratch/,Abdelhady Esmaeel,4.5,11,2.5,29,All Levels,19.99,11.99,40
1493,Aerospace Masterclass: Transonic Aerodynamics,https://www.udemy.com/course/transonic-aerodynamics/,Martin Yanev,3.9,11,8.0,50,All Levels,129.99,11.99,71
1494,Advanced Calculus of Higher Mathematics,https://www.udemy.com/course/advanced-calculus-of-higher-mathematics/,Moein Ud Din,4.9,11,20.5,191,All Levels,129.99,11.99,7761
1495,IELTS Academic Writing - The Complete Step by Step Guide,https://www.udemy.com/course/ielts-academic-writing-last-minute-english/,Last Minute English: Francis Carlisle,4.9,11,7.5,91,Intermediate,64.99,11.99,74
1496,Energy saving in Steam Distribution System,https://www.udemy.com/course/energy-saving-in-steam-distribution-system/,Dr Sonal Desai,4.2,11,1.5,7,Intermediate,49.99,11.99,171
1497,Building Confidence in Online Teaching and Facilitating,https://www.udemy.com/course/building-confidence-in-online-teaching-and-facilitating/,Eileen Flanagan,3.7,11,1.5,7,All Levels,24.99,11.99,32
1498,English Grammar Tenses & Structures From Zero to Master,https://www.udemy.com/course/english-grammar-tenses-structures-from-zero-to-master/,English Tutor,3.6,11,1.0,19,Beginner,129.99,11.99,28
1499,Witty Owl's English Grammar Illustrated™,https://www.udemy.com/course/wittyowl/,Witty Owl,4.4,11,1.0,23,Beginner,19.99,11.99,2065
1500,Population Aging and the Demographic Transition,https://www.udemy.com/course/population-aging-and-the-demographic-transtion/,Jonathan Ezer,4.2,11,33.0,6,All Levels,19.99,11.99,135
1501,Learn Russian Language - Russian For Beginners 2,https://www.udemy.com/course/russian-for-beginners-2/,Ilona Protchenko,3.7,11,2.5,30,All Levels,29.99,11.99,421
1502,IELTS Academic Writing - The Complete Step by Step Guide,https://www.udemy.com/course/ielts-academic-writing-last-minute-english/,Last Minute English: Francis Carlisle,4.9,11,7.5,91,Intermediate,64.99,11.99,74
1503,English That's Not Safe for School: Swear Words,https://www.udemy.com/course/english-thats-not-safe-for-school-swear-words/,Ellen Mann,4.7,11,1.0,15,All Levels,19.99,11.99,25
1504,Social Psychology,https://www.udemy.com/course/social-psychology-s/,Keiarra Ortiz-Cedeno,3.9,11,1.0,29,Beginner,49.99,11.99,950
1505,Online Course Profits,https://www.udemy.com/course/online-course-profits/,Jeanette Cates,4.9,11,2.5,25,All Levels,19.99,11.99,122
1506,"Ready, Set, Record: Creating Video Content for the Classroom",https://www.udemy.com/course/tutorialvideos/,Matthew Alanis,4.3,11,2.5,15,Beginner,24.99,11.99,408
1507,Create Meaningful Relationships with Children through PLAY,https://www.udemy.com/course/creating-meaningful-relationships-with-children-through-play/,Matt Peterson,5.0,11,39.0,30,Beginner,39.99,11.99,17
1508,Yoga Teacher Training 100 Hour - Category Five,https://www.udemy.com/course/yoga-teacher-training-100-hour-category-five/,Paul Carlos,4.5,11,3.5,28,Beginner,69.99,11.99,115
1509,Learn Daily-Use Spoken English In 2 Hours,https://www.udemy.com/course/the-practical-spoken-english-that-young-people-are-learning/,Will's English Studio,4.7,11,3.0,17,All Levels,49.99,11.99,62
1510,Get Ready for Your First Online Course,https://www.udemy.com/course/overcome-fear-create-your-first-online-course/,Sheetal Mulay,4.2,11,1.0,20,Beginner,39.99,11.99,1043
1511,Scholarship Winner: Learn Strategies to Pay for College,https://www.udemy.com/course/scholarship-winner-learn-strategies-to-pay-for-college/,Shayla Price,4.1,11,1.0,21,All Levels,49.99,11.99,358
1512,Math Explained Easy 2 - Fractions,https://www.udemy.com/course/math-explained-easy-fractions/,Antonie van Voorden,4.8,11,41.0,7,Beginner,44.99,11.99,1628
1513,Master REAL Useful English with PROJECTS,https://www.udemy.com/course/realenglishpractice/,Jesse Sweed,4.9,11,2.5,40,All Levels,59.99,11.99,70
1514,An Overview of Coastal Ecology,https://www.udemy.com/course/coastal-ecology/,Jennifer McCarthey Tyrell,4.0,11,1.5,10,All Levels,19.99,11.99,49
1515,Instant Anatomy: A course in Human Anatomy,https://www.udemy.com/course/instantanatomy/,Robert Whitaker,3.6,11,23.0,142,All Levels,0.0,49.99,73
1516,D.R.E.A.M System To Create A Udemy Course Fast - Unofficial,https://www.udemy.com/course/fastcourse/,Nikhil Parekh,4.5,11,3.5,20,All Levels,129.99,11.99,1509
1517,Approach to hemorrhagic shock in small animals (veterinary),https://www.udemy.com/course/approach-to-hemorrhagic-shock-in-small-animals-veterinary/,"Igor Yankin, DVM, DACVECC",4.5,11,1.0,6,Intermediate,49.99,11.99,33
1518,(How to Get) Your Best English,https://www.udemy.com/course/how-to-get-your-best-english/,Nina Weinstein,4.8,11,44.0,6,Intermediate,24.99,11.99,55
1519,Master the Fundamentals of Geometry | Learn Geometry Basics,https://www.udemy.com/course/master-the-fundamentals-of-geometry/,LetsTute Make it Easy,4.0,11,8.5,63,All Levels,19.99,11.99,609
1520,Gods and Kings: The Art History of Mesopotamia and Arabia,https://www.udemy.com/course/gods-and-kings-the-art-history-of-mesopotamia-and-arabia/,Dr. Lily Filson,4.0,11,1.0,5,All Levels,24.99,11.99,69
1521,Online ESL Games,https://www.udemy.com/course/online-esl-games/,John Angelo,4.7,11,2.5,54,All Levels,39.99,11.99,58
1522,IELTS Step-by-step | Mastering Reading & Writing,https://www.udemy.com/course/ielts-step-by-step-mastering-reading-writing-combo/,"James Castleden, MA Applied Linguistics & DELTA",4.1,11,33.0,226,All Levels,29.99,11.99,74
1523,The Road to Improving Your Writing,https://www.udemy.com/course/the-road-to-becoming-a-better-writer/,Etc Services,4.2,11,1.5,13,All Levels,29.99,11.99,622
1524,Speak Hebrew like a Native: A Practical Conversation Course,https://www.udemy.com/course/speak-hebrew-like-a-native/,ID Consulting,4.4,11,1.5,54,Beginner,129.99,11.99,176
1525,"10 real-life short stories in Chinese, Pinyin and English",https://www.udemy.com/course/100-real-life-short-stories-in-chinese-update-each-week/,John Wang,4.6,11,1.0,11,All Levels,24.99,11.99,2068
1526,Swahili for Beginners.,https://www.udemy.com/course/swahili-for-beginners-z/,Karia Justin David,4.5,11,3.0,33,Beginner,19.99,11.99,59
1527,Grade 11 Mathematics from start to finish,https://www.udemy.com/course/grade-11-mathematics/,Lamprecht@Lotter Lötter,4.3,11,20.0,176,All Levels,109.99,11.99,61
1528,2014 Great Decisions: Foreign Policy Association,https://www.udemy.com/course/greatdecisions/,"Foreign Policy Association, Jeffrey Morton",4.8,11,3.5,24,All Levels,24.99,11.99,105
1529,Maths Functions for Beginners,https://www.udemy.com/course/mathematical-functions-basics/,D&D Finance,3.3,11,1.5,15,All Levels,24.99,11.99,1386
1530,Julius Caesar Part One: Early Life and Career,https://www.udemy.com/course/julius-caesar-part-one/,"David Halsted, Chris Halsted",4.1,11,1.5,19,All Levels,19.99,11.99,82
1531,Mathematical Logic for Computer Science,https://www.udemy.com/course/mathematical-logic-for-computer-science/,Manuela B,4.8,11,1.5,22,All Levels,39.99,11.99,50
1532,How to get a Band 7 in your IELTS Writing!,https://www.udemy.com/course/the-ielts-writing-course/,Deepa Rama,3.8,11,2.5,10,Intermediate,49.99,11.99,85
1533,Graduate School Admission Strategy for American Schools,https://www.udemy.com/course/graduate-school-admission-strategy-for-american-schools/,Collmission Learning Venture,4.0,11,1.5,14,All Levels,39.99,11.99,532
1534,Physics of Life 3. Fluids,https://www.udemy.com/course/physics-of-life-3-fluids/,Scott Turner,5.0,11,5.5,33,Intermediate,19.99,11.99,81
1535,Mathematics: Refresher Course,https://www.udemy.com/course/mathematics-refresher-course/,Seema Ranaware,4.6,11,5.0,29,Intermediate,34.99,11.99,1016
1536,The Most Common Mistakes in English and How to Avoid Them,https://www.udemy.com/course/70-common-mistakes-in-english/,Henry Cassidy ✅,4.9,11,3.5,13,Intermediate,74.99,11.99,223
1537,New SAT Math Crash Course,https://www.udemy.com/course/new-sat-math-crash-course/,Scott Grierson,3.9,11,2.5,42,All Levels,99.99,11.99,73
1538,Learning Strategies for Authentic Classroom Engagement,https://www.udemy.com/course/learning-strategies-for-authentic-classroom-engagement/,Dr. Dheeraj Mehrotra,3.4,11,1.0,10,All Levels,19.99,11.99,0
1539,Learn Quadratic Equations and Functions,https://www.udemy.com/course/learn-quadratic-equations-and-functions/,Sohail Siddiqui,4.3,11,2.0,29,All Levels,129.99,11.99,3678
1540,Basics of Trigonometry and its Applications- Math | Geometry,https://www.udemy.com/course/basics-of-trigonometry-and-its-applications/,LetsTute Make it Easy,4.3,11,2.0,14,Beginner,19.99,11.99,936
1541,SAT Chemistry Course - Test Preparation,https://www.udemy.com/course/sat-chemistry-course-test-preparation/,BILAL AHMAD,3.9,11,5.0,30,All Levels,19.99,11.99,41
1542,Math Worksheets Grades 2  Grade 3,https://www.udemy.com/course/video-math-worksheets-for-kids-grades-2-and-3/,Sandy Ingram,4.5,11,1.5,19,Beginner,19.99,11.99,1045
1543,Acting & Musical Theatre: Smashing the Drama School Audition,https://www.udemy.com/course/drama-school-audition/,Brian Antoni Maitland,4.4,11,1.5,15,Beginner,19.99,11.99,51
1544,C Language tricky Questions (Company specific),https://www.udemy.com/course/best-150-mcqs-in-c/,shravan Kumar Manthri,3.5,11,5.0,30,All Levels,34.99,11.99,1497
1545,Welcome to the Circular Economy,https://www.udemy.com/course/welcome-to-the-circular-economy/,Michael Boyle,3.8,11,2.0,23,Beginner,129.99,11.99,51
1546,Chinese Course: Mastering Pinyin and Pronunciation,https://www.udemy.com/course/free-chinese-course-mastering-pinyin-and-pronunciation/,"8th Avenue Chinese, Mark Schold, Chris Simpson and Julie Tianxia Zhong",4.9,11,2.0,40,Beginner,19.99,11.99,657
1547,Chinese Idiom Stories and Chinese Philosophies season 1,https://www.udemy.com/course/chinese-idiom-stories-and-chinese-philosophies-season-1/,Hong Zeng,4.3,11,6.5,43,All Levels,0.0,0.0,294
1548,Everyday English: Learn Practical Real English Fast,https://www.udemy.com/course/everestenglish1/,Ben Murray,4.6,10,1.0,16,Beginner,0.0,0.0,42
1549,"Greek poetry: ""Ithaca"" by Constantine Cavafy",https://www.udemy.com/course/greek-poetry/,Irene Karageorgos,4.5,10,42.0,26,All Levels,0.0,0.0,501
1550,Philosophical and Sociological Perspectives of Education,https://www.udemy.com/course/philosophical-and-sociological-perspectives-of-education/,Dr. Dheeraj Mehrotra,2.5,10,1.5,20,All Levels,0.0,0.0,952
1551,Best Online Course for Math Olympiads/IITJEE/BITSAT/KVPY/VIT,https://www.udemy.com/course/number-theory-maths-basics-for-school-and-college-students/,Devaki subbalakshmi,4.1,10,6.0,115,All Levels,0.0,0.0,2203
1552,Impact of Climate Change on Human Health,https://www.udemy.com/course/climate-change-and-human-health/,Anupriya Aggarwal,4.2,10,39.0,10,Beginner,0.0,0.0,48
1553,Survival Russian Language Course,https://www.udemy.com/course/survival-russian-language-course-for-football-fans/,Irina Skibenko,4.5,10,1.0,44,Beginner,0.0,0.0,1402
1554,Nurse Aide CEP Written Test Prep E-Learning Course,https://www.udemy.com/course/nurse-aide-written-exam-prep-tutorial/,JULIE REYNOLDS,4.4,10,1.0,11,All Levels,0.0,0.0,27
1555,Complex Technology Systems,https://www.udemy.com/course/complex-technology-systems/,Systems Innovation,4.3,10,4.0,24,All Levels,0.0,0.0,72
1556,Math Foundation: Geometry,https://www.udemy.com/course/math-foundation-geometry/,Dave James,4.3,10,4.0,109,Beginner,0.0,0.0,658
1557,Learn Redox Reactions In Easy Steps (Chemistry),https://www.udemy.com/course/learn-redox-reactions-in-easy-steps-chemistry/,Gurkan Ozer,4.2,10,1.5,23,All Levels,0.0,0.0,892
1558,Learn Turkish Easily,https://www.udemy.com/course/learn-turkish-easily/,Alaa Jalboush,3.7,10,6.0,45,Beginner,0.0,0.0,786
1559,Biofuels In Automobiles :  Alternative Fuels,https://www.udemy.com/course/biofuels-in-automobile-mechanical-alternativefuels-ezenith-engineering/,Ezenith Education,3.6,10,4.0,81,Beginner,0.0,0.0,52
1560,Vector Calculus Basics for Engineering Students,https://www.udemy.com/course/vector-math-basics-for-engineering-students/,"Cherish Qualls, PhD",4.8,10,5.5,19,Beginner,0.0,0.0,73
1561,Forensic Crash Investigation according to the IBF Protocol,https://www.udemy.com/course/theibfprotocol/,Stanley S Bezuidenhout,4.7,10,3.5,96,Intermediate,0.0,0.0,12
1562,Learn Redox Reactions In Easy Steps (Chemistry),https://www.udemy.com/course/learn-redox-reactions-in-easy-steps-chemistry/,Gurkan Ozer,4.2,10,1.5,23,All Levels,19.99,11.99,892
1563,Biofuels In Automobiles :  Alternative Fuels,https://www.udemy.com/course/biofuels-in-automobile-mechanical-alternativefuels-ezenith-engineering/,Ezenith Education,3.6,10,4.0,81,Beginner,129.99,11.99,52
1564,Vector Calculus Basics for Engineering Students,https://www.udemy.com/course/vector-math-basics-for-engineering-students/,"Cherish Qualls, PhD",4.8,10,5.5,19,Beginner,19.99,11.99,73
1565,Philosophical and Sociological Perspectives of Education,https://www.udemy.com/course/philosophical-and-sociological-perspectives-of-education/,Dr. Dheeraj Mehrotra,2.5,10,1.5,20,All Levels,19.99,11.99,952
1566,Complex Technology Systems,https://www.udemy.com/course/complex-technology-systems/,Systems Innovation,4.3,10,4.0,24,All Levels,39.99,11.99,72
1567,Math Foundation: Geometry,https://www.udemy.com/course/math-foundation-geometry/,Dave James,4.3,10,4.0,109,Beginner,99.99,11.99,658
1568,Learn Turkish Easily,https://www.udemy.com/course/learn-turkish-easily/,Alaa Jalboush,3.7,10,6.0,45,Beginner,19.99,11.99,786
1569,Nurse Aide CEP Written Test Prep E-Learning Course,https://www.udemy.com/course/nurse-aide-written-exam-prep-tutorial/,JULIE REYNOLDS,4.4,10,1.0,11,All Levels,19.99,11.99,27
1570,Survival Russian Language Course,https://www.udemy.com/course/survival-russian-language-course-for-football-fans/,Irina Skibenko,4.5,10,1.0,44,Beginner,19.99,11.99,1402
1571,"Modeling, Simulation and Control using Python",https://www.udemy.com/course/modeling-simulation-and-control-using-python/,Muthiah Shanmugam,3.7,10,1.5,15,Intermediate,29.99,11.99,47
1572,Impact of Climate Change on Human Health,https://www.udemy.com/course/climate-change-and-human-health/,Anupriya Aggarwal,4.2,10,39.0,10,Beginner,19.99,11.99,48
1573,Best Online Course for Math Olympiads/IITJEE/BITSAT/KVPY/VIT,https://www.udemy.com/course/number-theory-maths-basics-for-school-and-college-students/,Devaki subbalakshmi,4.1,10,6.0,115,All Levels,29.99,11.99,2203
1574,Forensic Crash Investigation according to the IBF Protocol,https://www.udemy.com/course/theibfprotocol/,Stanley S Bezuidenhout,4.7,10,3.5,96,Intermediate,0.0,199.99,12
1575,"Greek poetry: ""Ithaca"" by Constantine Cavafy",https://www.udemy.com/course/greek-poetry/,Irene Karageorgos,4.5,10,42.0,26,All Levels,19.99,11.99,501
1576,Strategic Economic Decision Making,https://www.udemy.com/course/strategic-economic-decision-making/,Jeff Grover,2.9,10,12.0,32,All Levels,94.99,11.99,160
1577,Mini Implants in Orthodontics,https://www.udemy.com/course/mini-implants-in-orthodontics/,Ivelina Koycheva,5.0,10,5.0,13,All Levels,0.0,199.99,127
1578,Paint a cat in watercolor.,https://www.udemy.com/course/paint-a-cat-in-watercolor/,"Olga Osnach, Anastasia Modestova",4.4,10,32.0,6,Intermediate,119.99,11.99,55
1579,Coastal Engineering,https://www.udemy.com/course/coastal-engineering/,Anilcan Taner,3.4,10,3.0,23,Intermediate,0.0,19.99,26
1580,Turkish Language Grammar for Beginners (Fun and Fast),https://www.udemy.com/course/turkish-language-grammar-for-beginners-fun-and-fast/,Sanan Mirzayev,4.1,10,1.0,16,Beginner,19.99,11.99,63
1581,Building Structures in Spanish - Structure 3,https://www.udemy.com/course/building-structures-in-spanish-structure-3/,Kieran Ball,4.8,10,2.0,34,Beginner,129.99,11.99,743
1582,Beyond English: IELTS Writing Task 2,https://www.udemy.com/course/beyond-english-ielts-writing-task-2/,Mark Smith,3.9,10,2.0,11,Intermediate,19.99,11.99,60
1583,Write a Great Research Paper for Success in School!,https://www.udemy.com/course/research-paper/,"Ugur Akinci, Ph.D.",4.2,10,4.0,45,Beginner,0.0,49.99,1016
1584,"Be Expert in Swahili Language ""For Beginners""",https://www.udemy.com/course/be-expert-in-swahili-language-for-beginners/,Baraka Yohana Sanga,4.5,10,2.5,12,Beginner,34.99,11.99,45
1585,How To Study the Bible and Enjoy It,https://www.udemy.com/course/how-to-study-the-bible-and-enjoy-it/,Dr. Irie Session,4.2,10,1.0,23,All Levels,29.99,11.99,46
1586,Italian for Beginners A0-A1-A2 | Complete Grammar + Writing,https://www.udemy.com/course/italian-beginners/,Marco Luzi,4.8,10,4.0,59,Beginner,59.99,11.99,62
1587,Master the GK Reading Subtest,https://www.udemy.com/course/master-the-gk-reading-exam/,Elaine Chandler,4.7,10,2.5,19,All Levels,39.99,11.99,153
1588,Principle of Chemical Processes (Two Semester Combined),https://www.udemy.com/course/principle-of-chemical-processes-two-semester-combined/,Kathy Zhang,4.2,10,9.0,52,All Levels,19.99,11.99,87
1589,English Professional Emails,https://www.udemy.com/course/write-excellent-business-emails/,English Academy,3.5,10,1.5,9,Intermediate,19.99,11.99,79
1590,Basic Chinese Study Pinyin Program for Beginners,https://www.udemy.com/course/basic-chinese-study-pinyin-program-for-beginners/,Miracle Mandarin Chinese School,4.0,10,1.0,10,Beginner,74.99,11.99,80
1591,Introduction to Basic Electronics for Engineering,https://www.udemy.com/course/introduction-to-basic-electronics-for-engineering/,Ambily Babu,4.0,10,1.0,9,Beginner,19.99,11.99,36
1592,Learn Advanced Psychology - Spiral Dynamics Basics,https://www.udemy.com/course/spiral-dynamics/,Justin Quinton,3.7,10,1.5,6,Beginner,34.99,11.99,1932
1593,Finishing the orthodontic case and retention,https://www.udemy.com/course/finishing-the-orthodontic-case-and-retention/,Ivelina Koycheva,5.0,10,4.0,8,All Levels,0.0,199.99,116
1594,Developing Creative Intelligence among Kids,https://www.udemy.com/course/developing-creative-intelligence-among-kids/,Dr. Dheeraj Mehrotra,4.5,10,37.0,7,All Levels,19.99,11.99,24
1595,Armenian for Beginners,https://www.udemy.com/course/armenian-for-beginners/,Ruzan Mkhitaryan,3.0,10,1.0,14,All Levels,19.99,11.99,86
1596,Terrorism and Counter-terrorism,https://www.udemy.com/course/terrorism-and-counter-terrorism/,SIA Global Security,4.6,10,4.0,41,All Levels,99.99,11.99,35
1597,Edeo - Educational video courses and Marketing Introduction,https://www.udemy.com/course/edeo-educational-video-courses-and-marketing-introduction/,David Yao,3.4,10,6.0,53,All Levels,99.99,11.99,4053
1598,Udemy Course Marketing: Social Media & SEO guide ~Unofficial,https://www.udemy.com/course/udemysocialmedia/,"Sergey Kasimov, Jewel & Auret",4.1,10,5.5,66,All Levels,29.99,11.99,1129
1599,Algebra,https://www.udemy.com/course/algebra-part-1/,Twinkle Shah,4.9,10,5.0,43,Beginner,19.99,11.99,55
1600,Reservoir Engineering Fundamentals,https://www.udemy.com/course/reservoir-engineering-fundamentals/,Hamam Awad,4.1,10,5.5,29,All Levels,69.99,11.99,44
1601,Improve Your Reading Skills Through Mindfulness,https://www.udemy.com/course/mindful-reading/,Marcy Sproull,4.4,10,34.0,5,All Levels,19.99,11.99,610
1602,Greek Language Made Simple - A Complete Guide,https://www.udemy.com/course/greek-language-made-simple-a-complete-guide/,Courseship Courses,3.9,10,1.0,29,Beginner,19.99,11.99,2059
1603,Essential Academic English: Prefixes & Suffixes,https://www.udemy.com/course/essential-academic-english-prefixes-suffixes/,Daniel Owen,4.7,10,4.5,52,Intermediate,39.99,11.99,2923
1604,Western European Art After the Fall of Rome,https://www.udemy.com/course/western-european-art-after-the-fall-of-rome/,Dr. Lily Filson,3.4,10,39.0,5,All Levels,24.99,11.99,60
1605,Electrostatics basics,https://www.udemy.com/course/electrostatics-basics/,Prateek Kumar,3.6,10,2.5,13,Beginner,19.99,11.99,514
1606,Basics of Digital Image Processing Hands-on Using Matlab,https://www.udemy.com/course/digital-image-processing-using-matlab/,Pragati Sunilkumar Dwivedi,4.2,10,3.0,15,All Levels,19.99,11.99,54
1607,Nero Magic: world's fastest math tricks to beat calculator,https://www.udemy.com/course/nero-magic-speed-math-tricks/,Nero _,4.4,10,1.5,8,All Levels,19.99,11.99,824
1608,Learning To Teach Online,https://www.udemy.com/course/learning-to-teach-online/,Dr. Dheeraj Mehrotra,1.5,10,37.0,7,All Levels,19.99,11.99,0
1609,Black History: UnMaking of a Slave Vol. 1 Series 1,https://www.udemy.com/course/black-history-unmaking-of-a-slave-v1s1/,"MAWMedia Group, LLC",3.8,10,2.0,12,Beginner,19.99,11.99,29
1610,Chinese Characters You Must Know for HSK 1-2 Volume 1,https://www.udemy.com/course/the-most-common-chinese-characters-001-100-according-hsk/,David Yao,4.4,10,8.5,53,All Levels,129.99,11.99,3824
1611,Enrichment analysis: interpret gene lists like a pro,https://www.udemy.com/course/gene-enrichment-analysis/,"Csaba Ortutay, Zsuzsanna Ortutay",3.5,10,43.0,16,Intermediate,44.99,11.99,75
1612,Social worker and Counselling,https://www.udemy.com/course/social-worker-and-counselling/,Ss B,3.5,10,1.0,30,Beginner,129.99,11.99,27
1613,The ultimate organic chemistry animation course.,https://www.udemy.com/course/the-ultimate-organic-chemistry-animation-course/,ahmad hegazy,5.0,10,1.0,23,Intermediate,39.99,11.99,67
1614,History of English Law: A Comprehensive Summary,https://www.udemy.com/course/history-of-law/,Shaveen Bandaranayake,4.5,10,1.5,13,All Levels,49.99,11.99,46
1615,The Age of Exploration or The Age of Discovery,https://www.udemy.com/course/the-age-of-exploration-or-the-age-of-discovery/,Farid Guerby,3.9,10,1.0,17,All Levels,34.99,11.99,29
