,course_name,course_link,course_instr,course_rating,coures_reviews,course_totalHourse,course_lectures,course_level,price,price_dis,course_enrollmenters
725,Of Markets & Men:A Visual Introduction to Austrian Economics,https://www.udemy.com/course/of-markets-and-men-visual-introduction-to-austrian-economics/,Fast Uptake,4.5,45,4.0,31,All Levels,34.99,11.99,245
726,Commercial Law in 150 Minutes: A Fast Track Summary,https://www.udemy.com/course/learn-commercial-law/,Shaveen Bandaranayake,4.2,45,2.5,34,All Levels,49.99,11.99,0
727,Get your Thesis Done,https://www.udemy.com/course/thesis-done/,"Ed Ferrer, Ph.D.",4.4,45,2.5,39,All Levels,129.99,11.99,1432
728,How the European Union works: become easily an EU expert,https://www.udemy.com/course/how-the-european-union-works-become-easily-an-eu-expert/,Alain de Raymond,4.3,45,3.5,50,All Levels,29.99,11.99,168
729,Linear Algebra: 40+ hours of Tutorials and Exercises!,https://www.udemy.com/course/linear_algebra/,"Kvasir Education, Bar Movsowowitz",4.3,45,48.5,517,All Levels,99.99,14.99,521
730,Udemy Instructor Course: Udemy for Instructors -Unofficial,https://www.udemy.com/course/udemy-instructor-course/,Mauricio Rubio - Agile Guru & Founder of AgileKB | AgileLee & Ureducation,4.6,45,1.0,9,Beginner,24.99,11.99,3930
731,Mass Balance Basics,https://www.udemy.com/course/introduction-to-mass-balance/,Chemical Engineering Guy,4.4,45,16.0,108,All Levels,24.99,11.99,287
732,Calculus of Variations,https://www.udemy.com/course/calculus-of-variations/,Ross McGowan,4.5,46,6.0,39,Intermediate,59.99,11.99,324
733,Mastering Farsi (Dari) - From Alphabet to Daily Conversation,https://www.udemy.com/course/masteringfarsi/,Ali Qasimi,4.5,44,3.5,79,All Levels,69.99,11.99,7960
734,FOCUS- The hidden driver of excellence!,https://www.udemy.com/course/focus-the-hidden-driver-of-excellence/,Dr. Dheeraj Mehrotra,3.5,44,1.0,10,All Levels,19.99,11.99,7440
735,Early orthodontic treatment of dentoskeletal problems,https://www.udemy.com/course/early-orthodontic-treatment-of-dentoskeletal-problems/,Ivelina Koycheva,4.7,44,3.0,7,All Levels,0.0,199.99,134
736,How to Design Professional Course Slides - For Instructors,https://www.udemy.com/course/how-to-design-professional-course-slides/,Ian Stables,4.2,44,1.0,13,All Levels,94.99,11.99,5492
737,Master the GRE Work & Rate problems,https://www.udemy.com/course/master-the-gre-work-rate-problems/,Anis MURR,4.5,44,1.5,22,All Levels,79.99,11.99,601
738,Be A Mental Math King,https://www.udemy.com/course/be-a-mental-math-king/,Do Mathematics,4.5,44,2.5,34,All Levels,49.99,11.99,5278
739,Mastering the IRAC Method for Law School Success,https://www.udemy.com/course/mastering-the-irac-method-for-law-school-success/,"Camilla Barker-DeStefano, DPhil (Oxon)",4.3,44,2.0,22,All Levels,129.99,11.99,187
740,English Basics for beginners,https://www.udemy.com/course/english-basics-for-beginners/,Andy Mann,4.3,44,1.0,24,Beginner,19.99,11.99,1045
741,English Writing: Perfect Your English Writing and Grammar,https://www.udemy.com/course/english-writing-and-grammar/,Joycellyn Akuffo,4.2,44,1.0,30,Intermediate,19.99,11.99,151
742,Hydraulics 101,https://www.udemy.com/course/hydraulics-101/,Vladimir Cavic,3.5,44,3.0,20,Intermediate,19.99,11.99,168
743,Academic Essay Writing: The Crash Course,https://www.udemy.com/course/academic-essay-writing-the-complete-crash-course/,Nina Modak,4.5,44,2.0,16,Beginner,129.99,11.99,2144
744,Advanced English Grammar Course ( TOEFL and IELTS ),https://www.udemy.com/course/advanced-english-grammar-course-toefl-and-ielts/,Annamária Ibos,4.0,44,2.0,19,Intermediate,69.99,11.99,0
745,Unofficial Udemy Course Marketing/Promotion for Beginners,https://www.udemy.com/course/unofficial-udemy-instructor-guide-udemy-course-marketing/,Brian Jackson,4.4,44,5.5,48,All Levels,19.99,11.99,5293
746,How to Teach Online with Zoom | Online Teaching Course,https://www.udemy.com/course/how-to-teach-online-with-zoom-online-teaching-course/,Eric Oscar Wesch,4.6,44,2.5,38,All Levels,89.99,11.99,820
747,Chinese Characters Piece by Piece,https://www.udemy.com/course/chinese-characters-piece-by-piece/,Brad Pritchett,4.2,44,2.5,18,Beginner,19.99,11.99,283
748,3 Minute German - Course 4 | Language lessons for beginners,https://www.udemy.com/course/3-minute-german-course-4/,Kieran Ball,4.7,44,7.0,110,Beginner,129.99,11.99,1454
749,French for beginners - From zero to pro in 60 minutes,https://www.udemy.com/course/french-for-beginners-from-zero-to-pro-in-60-minutes/,Emilie Schrevens,4.1,43,1.0,27,Beginner,34.99,11.99,2182
750,Small Talk in English,https://www.udemy.com/course/small-talk-in-english/,"Neil Cowie, Keiko Sakui",4.4,43,1.5,15,All Levels,19.99,11.99,283
751,Blender 2.8 The Basics Of 3D Modeling in Blender,https://www.udemy.com/course/blender-28-the-basics-of-3d-modeling-in-blender/,Umer Lachi,4.0,43,30.0,15,Beginner,24.99,11.99,1366
752,Basic Concepts of Mechanics of Materials for Machine Design,https://www.udemy.com/course/basic-concepts-of-mechanics-of-materials-for-machine-design/,Mufaddal Rasheed,4.1,43,4.5,87,All Levels,74.99,11.99,361
753,Udemy: Create a Udemy Course In 8 hours-Unofficial,https://www.udemy.com/course/8-hour-udemy-course-creation-challenge/,Michael Ingram,4.0,43,1.0,19,All Levels,24.99,11.99,1184
754,The Top-Down Approach to Problem Solving,https://www.udemy.com/course/hacking-stem/,"Eduardo Corpeño, Marissa Siliezar",4.9,43,2.5,74,Intermediate,129.99,11.99,429
755,Intro to Fluid Mechanics for Engineering Students Part 3,https://www.udemy.com/course/fluid-mechanics-for-engineering-students-part-3/,"Cherish Qualls, PhD",4.6,43,7.5,28,All Levels,69.99,11.99,529
756,English Pronunciation: improve with this effective course,https://www.udemy.com/course/voice-exercises-to-improve-your-speaking-voice/,"Serena Greenslade F.V.C.M. (Hons), A.N.E.A.",4.3,43,1.0,52,All Levels,39.99,11.99,410
757,BASIC ENGLISH COURSE TO LEARN WITH PRACTICAL WISDOM FOR LIFE,https://www.udemy.com/course/basic-english-course-for-students-with-healthmedical-topics/,Sarita Wariyer,2.8,43,1.5,10,Beginner,19.99,11.99,4471
758,Google Classroom for Educators and Students,https://www.udemy.com/course/virtual-classroom/,Kumail Raza,3.7,43,40.0,5,All Levels,129.99,11.99,7851
759,"NCLEX Simplified: Cardiac, Circulatory, and Musculoskeletal",https://www.udemy.com/course/nclex-simplified-cardiac-circulatory-musculoskeletal/,Lisa Chou,4.6,43,2.0,24,All Levels,19.99,11.99,219
760,World War 1 History,https://www.udemy.com/course/world-war-1-history/,Farid Guerby,3.8,43,1.0,21,All Levels,34.99,11.99,177
761,LEARN FRENCH IN 3 MONTHS  --  First Month,https://www.udemy.com/course/learn-french-fast/,Michael Beck,4.4,43,3.0,36,Beginner,0.0,29.99,301
762,Learn Chinese HSK 6 Intensive Reading Course H61001,https://www.udemy.com/course/learn-chinese-hsk-6-intensive-reading-course-h61001-video/,David Yao,4.3,43,16.0,69,Expert,139.99,12.99,352
763,Fractions for Grades 7-9.,https://www.udemy.com/course/fractions-for-grades-7-9/,Vlad Kish,4.6,43,31.0,13,Beginner,39.99,11.99,1230
764,Learn How To Teach On Skillshare: Create Bestselling Courses,https://www.udemy.com/course/teach-on-skillshare/,"Joe Parys, Joe Parys Support",4.6,42,2.0,30,All Levels,0.0,0.0,4704
765,Electrical Transformers Fundamentals,https://www.udemy.com/course/electrical-transformers-fundamentals/,Mike L,4.3,42,4.0,26,Beginner,0.0,0.0,0
766,"CFA Level 1 (2021) Fixed Income, Derivatives & Alternatives",https://www.udemy.com/course/cfa-level-1-fixed-income-analystprep/,Analyst Prep,4.2,42,4.5,15,All Levels,0.0,0.0,1659
767,SOLIDWORKS Course: Get Certified in CSWP Segment 1,https://www.udemy.com/course/solidworks-cswp-segment-1-training/,Labeat Musaj,3.5,42,1.0,11,All Levels,0.0,0.0,940
768,Beginners Guide to AI (Artificial Intelligence),https://www.udemy.com/course/beginners-guide-to-artificial-intelligence-or-ai/,Siim Õunap,4.1,42,39.0,6,Beginner,0.0,0.0,133
769,Complete Danish for Beginners,https://www.udemy.com/course/complete-danish-for-beginners/,Daily Danish,4.6,42,4.5,52,Beginner,0.0,0.0,275
770,Spanish: The Most Useful Words +100,https://www.udemy.com/course/spanish-for-beginners-the-most-useful-words-100/,Maxi La Runa,4.6,42,1.0,15,Beginner,0.0,0.0,906
771,Professional Therapist Online Business Diploma Course,https://www.udemy.com/course/professional-therapist-online-business-diploma-course/,Dr Karen E Wells,3.4,42,41.0,12,All Levels,0.0,0.0,171
772,SLLA Practice Prep,https://www.udemy.com/course/slla-practice-prep/,Adriese Williams,3.8,42,4.5,20,All Levels,0.0,0.0,399
773,Ultimate guide to Trigonometry,https://www.udemy.com/course/ultimate-guide-to-trigonometry/,Chanda Academy,4.3,42,4.0,20,All Levels,0.0,0.0,1145
774,Learn water treatment in STP,https://www.udemy.com/course/water-treatment-stp/,salman ali Syed,3.2,42,1.0,12,All Levels,0.0,0.0,104
775,Astronomy Without Telescope,https://www.udemy.com/course/astronomy-without-telescope/,Astron SHK Trust,4.1,42,44.0,8,All Levels,0.0,0.0,196
776,Vedic Maths Revealed - Faster Way Math Calculations,https://www.udemy.com/course/faster-than-calculator-2-ancient-math-tricks-revealed/,Rajinder Goswami,4.6,42,2.5,27,All Levels,0.0,0.0,550
777,Easy Italian to survive,https://www.udemy.com/course/italian-to-survive/,all4italy Laura,4.1,43,2.0,23,Beginner,0.0,0.0,9376
778,IIT Pave and Design of Pavements (Expert Course),https://www.udemy.com/course/design-of-unreinforced-and-reinforced-pavements/,"Vipin Joshi, AXE Consultants",2.0,42,4.5,21,Expert,0.0,0.0,4880
779,RoboGrok Robotics 1,https://www.udemy.com/course/robotics-1/,Angela Sodemann,4.7,41,13.0,45,Intermediate,24.99,11.99,2597
780,How to remember anatomy for a lifetime!,https://www.udemy.com/course/how-to-remember-anatomy-for-a-lifetime/,Ayman Taji,4.2,41,3.0,36,All Levels,49.99,11.99,631
781,English Language Presentation Skills,https://www.udemy.com/course/english-language-presentation-skills-for-non-native-speakers/,Barry Baguley,4.7,41,2.0,21,Intermediate,39.99,11.99,5806
782,Master in Geogebra for Mathematics,https://www.udemy.com/course/geogebra-for-mathematics/,"Mónica Coronel - EducaresEc, Margarita Coloma",4.1,41,2.0,43,All Levels,39.99,11.99,198
783,Udemy Academy: Find Killer Course Ideas That Sell Unofficial,https://www.udemy.com/course/udemy-mastery-finding-killer-course-ideas/,Daniel Boehm,4.8,41,1.0,9,All Levels,19.99,11.99,3251
784,"Maths grade 8 (1 of 5) Numbers, Operations & Relationships ",https://www.udemy.com/course/maths-grade-8-1of5/,Matthew Henshall,4.4,41,7.0,53,Beginner,39.99,11.99,387
785,"Piping Fabrication with Isometrics - Oil&Gas, Mechanical",https://www.udemy.com/course/piping-fabrication/,Mukesh Muraleedharan,4.4,41,4.0,25,All Levels,24.99,11.99,219
786,ASL | The Alphabet | American Sign Language,https://www.udemy.com/course/asl-alphabet/,Able Lingo,4.7,41,2.5,49,Beginner,19.99,11.99,2796
787,How to create online courses using Articulate Rise,https://www.udemy.com/course/how-to-create-online-courses-using-articulate-rise/,Prashant Gupta,4.0,41,1.5,20,Beginner,49.99,11.99,164
788,Russian Program For Fluency: Learn Russian With 3-in-1 Sets,https://www.udemy.com/course/learn-russian-program-for-fluency/,"Denis Ivanov, Olga Protska",4.2,41,4.0,30,All Levels,0.0,59.99,198
789,Hydraulic schematics and calculation exercises,https://www.udemy.com/course/hydraulic-schematics-and-calculation-exercises/,Vladimir Cavic,4.3,41,5.0,22,Intermediate,99.99,11.99,222
790,Immediately Useful! Japanese Business Etiquette,https://www.udemy.com/course/japanese-business-etiquette/,Attain Corp.,4.2,41,1.0,12,Beginner,44.99,11.99,275
791,Craft Successful College Admissions Essays - with Examples,https://www.udemy.com/course/collegebound/,Niki Agrawal,4.6,41,1.0,8,All Levels,0.0,109.99,202
792,Use of English CAE | C1 Advanced Cambridge English Exam,https://www.udemy.com/course/c1-advanced-cae-use-of-english/,Cambridge English Teacher Rory,4.0,40,6.0,33,Intermediate,99.99,11.99,268
793,Useful English Vocabulary & Idioms With Fluency Exercises,https://www.udemy.com/course/able-english-with-instagram-stories/,Able Lingo,4.2,40,2.5,55,Intermediate,19.99,11.99,1951
794,Japanese Language Teacher Training Program < Lesson 1 >,https://www.udemy.com/course/japanese-language-teacher-training-program-lesson-1/,Attain Corp.,4.4,40,2.0,17,Expert,99.99,11.99,166
795,"Engineering Dynamics course & examples, 15+hours mechanical",https://www.udemy.com/course/introduction-to-dynamics-online-course-mechanicalchemicalcivilengineer/,Rahsoft Mechanical Engineering Department,3.6,40,16.0,106,Beginner,19.99,11.99,826
796,Number Systems: Master of numbers conversion in 2020,https://www.udemy.com/course/number-systems-master-of-numbers-conversion-in-90-minutes/,Luis Carlos,4.2,40,1.5,28,All Levels,49.99,11.99,8934
797,How to Win at Teaching in Education,https://www.udemy.com/course/how-to-win-at-teaching-in-education/,Kirsty Cowperthwaite,4.5,40,3.0,22,All Levels,49.99,11.99,918
798,Revit MEP - Electrical systems,https://www.udemy.com/course/revit-mep-electrical-systems/,"AulaGEO Academy, Felix Enzo Garofalo Lanzuisi",4.1,41,3.5,28,All Levels,129.99,11.99,206
799,Material Science and Engineering,https://www.udemy.com/course/material-science-and-engineering/,Sahin Kaymak,3.7,40,2.0,38,All Levels,24.99,11.99,204
800,Teach on Udemy: How To Create Your First Course – Unofficial,https://www.udemy.com/course/unofficial-teach-on-udemy-how-to-create-your-first-course/,KC Tan,4.5,40,1.5,38,All Levels,129.99,11.99,986
801,Righteous Prosperity - Walking in Your Identity in Christ,https://www.udemy.com/course/righteous-prosperity-walking-in-your-identity-in-christ/,Tom Scarrella,4.8,40,9.5,44,All Levels,129.99,11.99,535
802,Writing Non-Fiction: The Essential Guide,https://www.udemy.com/course/writing-non-fiction/,Jane Bettany,4.3,40,2.0,27,Beginner,94.99,11.99,506
803,Science - Beginning With Physics!,https://www.udemy.com/course/science-beginning-with-physics/,Graham Bray,4.4,40,4.5,50,Beginner,19.99,11.99,191
804,Easy Conversational Spanish: Speak Spanish In A Few Days,https://www.udemy.com/course/easy-conversational-spanish/,Learn Spanish 101,1.9,40,1.5,36,All Levels,29.99,11.99,1332
805,Signal Processing- Discrete Fourier Transform (DFT/FFT),https://www.udemy.com/course/signal-processing-dft-fft/,Yogesh Prabhu,4.9,40,1.5,8,Beginner,129.99,11.99,1052
806,Learn Urdu Language: Urdu Speaking Reading Writing Grammar,https://www.udemy.com/course/learn-urdu-speaking-reading-writing-from-english/,Ifactner Learning,4.4,40,17.5,134,All Levels,19.99,11.99,246
807,Speak Spanish from day 1 + Skype time with our instructors!,https://www.udemy.com/course/speak-spanish-from-day-1/,David Alcántara,4.1,39,6.0,67,All Levels,19.99,11.99,6058
808,Advanced Algebra: Strategies for Success,https://www.udemy.com/course/algebraone/,Joe Huston,4.7,39,8.0,65,All Levels,34.99,11.99,461
809,How To Build An Online Courses Business - Your Success Guide,https://www.udemy.com/course/how-to-build-an-online-courses-business-your-success-guide/,Sorin Constantin,3.5,39,4.0,31,All Levels,129.99,11.99,3066
810,10 Hacks for the IELTS Listening Component,https://www.udemy.com/course/ieltslistening/,Christopher Fehr,4.2,38,31.0,17,Beginner,19.99,11.99,2070
811,Basic Listening Skills,https://www.udemy.com/course/englishvid-basiclistening/,Ahmad Rabiee,4.5,38,3.0,49,Beginner,39.99,11.99,1635
812,NLP FOR TEACHERS,https://www.udemy.com/course/nlp-for-teachers/,Dr. Dheeraj Mehrotra,4.3,38,1.0,8,All Levels,19.99,11.99,0
813,NCLEX RN Cardiovascular System & Medications,https://www.udemy.com/course/nclex-rn-cardiovascular-system-medications/,Anila Simon,4.3,38,6.5,28,All Levels,54.99,11.99,194
814,Life Coaching Course: Automate Your Own Coaching Business,https://www.udemy.com/course/life-coaching-business/,Federico Fort,3.5,38,2.5,20,Beginner,99.99,11.99,2143
815,Quantum Physics/Quantum Computing (University Level Course),https://www.udemy.com/course/mastering-the-fundamental-of-quantum-physics-level-1-course/,AD Chauhdry (AD Maths Plus Academy),3.5,38,8.5,43,Expert,94.99,11.99,430
816,"Writing an Excellent Dissertation / Thesis in Ten ""Days""!",https://www.udemy.com/course/writing-an-excellent-dissertation-thesis-in-ten-days/,Glensinos Interdisciplinary Center,4.4,38,1.5,13,Intermediate,39.99,11.99,175
817,Advanced English: Achieve English Fluency,https://www.udemy.com/course/advanced-english-course/,Joe Saenz,3.4,38,2.0,26,Expert,19.99,11.99,219
818,German for beginners -  for business or holidays - and more!,https://www.udemy.com/course/beginners-german-for-busy-people-for-business-or-holidays/,Angelika Davey,4.9,38,3.0,52,Beginner,34.99,11.99,2535
819,Prep for GRE® SubjectMathExam-Module4:Multivariable Calculus,https://www.udemy.com/course/gre-subject-math-prep-module4-multivariable-calculus/,Gilad Pagi,4.5,38,1.0,9,Expert,0.0,34.99,342
820,Learn Irish Gaelic,https://www.udemy.com/course/irish-gaelic/,Cathal Ó Manacháin,4.0,38,38.0,16,Beginner,44.99,11.99,777
821,Vedic Math & Mental Math - MULTIPLICATION : Full Course,https://www.udemy.com/course/vedic-math-mental-math-multiplication-full-course/,Max Math Games,4.5,38,4.5,90,All Levels,89.99,11.99,9494
822,Spanish Tenses Simplified: Master the Main Tenses FAST!,https://www.udemy.com/course/spanishtenses/,"Scott McElroy, Jonathan Price",3.8,38,3.0,14,All Levels,94.99,11.99,1712
823,CFA Level 1 (2021) Portfolio Management + Practice Questions,https://www.udemy.com/course/cfa-level-1-portfolio-management-analystprep/,Analyst Prep,4.3,38,4.0,9,All Levels,24.99,11.99,1932
824,Train the Trainer Coach: Complete Guide to Coaching Trainers,https://www.udemy.com/course/train-the-trainer-coach-pro-coaching-trainers-mastery-class/,Jason Teteak,4.0,37,16.5,76,Expert,159.99,14.99,352
825,Finally Get It In French Grammar,https://www.udemy.com/course/finally-get-it-in-french-grammar/,Kerstin Cable,4.1,37,2.5,20,All Levels,39.99,11.99,622
826,Air Dispersion Modeling for Environmental Management,https://www.udemy.com/course/air-dispersion-modeling-aermod/,Academia de Meio Ambiente,3.8,37,5.0,49,Intermediate,0.0,24.99,156
827,RoboAuthor: Content Writing Automation 2021 - Part 4,https://www.udemy.com/course/roboauthor-content-writing-automation-2020-part-4/,"Srinidhi Ranganathan, Saranya Srinidhi",3.2,37,1.5,9,Beginner,19.99,11.99,11509
828,Introduction to Transformers (Electrical Engineering),https://www.udemy.com/course/introduction-to-electrical-transformers/,saVRee 3D,4.3,37,3.0,40,All Levels,0.0,24.99,135
829,Uber Analytics Test with real questions from exam,https://www.udemy.com/course/uberanalytics/,Marquett Burton,3.3,37,2.5,34,All Levels,34.99,11.99,83
830,How to sand a surfboard to pro quality without experience.,https://www.udemy.com/course/how-to-sand-a-surfboard-to-pro-quality-without-experience/,Matthew Kinoshita,4.8,37,30.0,6,All Levels,0.0,59.99,95
831,Math Made Easy: Fundamental Math Skills for Students,https://www.udemy.com/course/math-made-easy/,"Nashad Najimudeen, Rushda Halith",4.4,37,8.0,59,All Levels,19.99,11.99,149
832,Online Japanese JLPT N4 Mock Examination（All 3 sets）,https://www.udemy.com/course/japanese-n4-mock-examinationall-3-sets/,Attain Corp.,3.9,37,2.0,9,Beginner,44.99,11.99,1140
833,Learn English Idioms and Expressions with Diana,https://www.udemy.com/course/learn-english-idioms-and-expressions-with-diana/,"Terry Mc Gonigle, Diana Rutkevica",4.5,37,8.0,35,Beginner,129.99,11.99,3920
834,Introduction to Batteries (Electrical Engineering),https://www.udemy.com/course/introduction-to-batteries/,saVRee 3D,4.4,37,2.5,59,All Levels,0.0,19.99,161
835,"Speak English with StorySpeaking: ""A car for a kiss?""",https://www.udemy.com/course/storyspeaking-english/,Dmitry Volov,4.0,37,35.0,15,Beginner,94.99,11.99,150
836,Elementary English Level II: Complete Course,https://www.udemy.com/course/elementary-english-level-2-complete-course/,Brigitte Wayman,4.5,37,8.5,50,Beginner,49.99,11.99,7732
837,English Grammar for Kids: Basic Grammar Program,https://www.udemy.com/course/fun-grammar-4kids-complete-learning-program/,Marc Lindsey,4.4,37,2.0,16,Beginner,24.99,11.99,270
838,Mastering Control Systems : Very basics to Advance,https://www.udemy.com/course/mastering-control-systems-very-basics-to-advance/,Srinivas Andoor,4.3,37,19.0,100,All Levels,129.99,11.99,306
839,Essential physics : Master classical and Newtonian mechanics,https://www.udemy.com/course/essential-physics-master-classical-and-newtonian-mechanics/,WR Training,4.5,36,7.5,68,All Levels,99.99,11.99,430
840,TOEFL Writing - The Complete Guide,https://www.udemy.com/course/toefl-writing-the-complete-guide/,Keehwan Kim,4.6,36,2.5,28,Beginner,69.99,11.99,272
841,Remote Learning with Microsoft Teams,https://www.udemy.com/course/remote-learning-with-microsoft-teams/,Matthew Nickerson,4.4,36,3.0,29,Beginner,49.99,11.99,139
842,Basics Of Probability : Learn With Probability Examples,https://www.udemy.com/course/probability-basics-build-strong-fundamentals-of-probability/,"Malay Biswal PMP, SAFe PO/PM, Math and Telecom Enthusiast",4.5,36,4.0,47,Beginner,24.99,11.99,2043
843,Restoring Dental Implants with CEREC and TiBase,https://www.udemy.com/course/restoring-dental-implants-with-cerec-and-tibase/,Dave King,4.7,36,2.5,9,Expert,129.99,11.99,150
844,Vedic Maths: My Every Student will be a Math Genius!,https://www.udemy.com/course/learn-vedic-maths/,"Jimmy Razo, Frazer Dan",4.3,36,3.5,18,Intermediate,129.99,11.99,996
845,"Certified Welding Inspector ""CWI"" Requirements",https://www.udemy.com/course/certified-welding-inspector-cwi-requirements/,Glen Lewis,4.1,36,1.0,12,Beginner,69.99,11.99,623
846,Clinical Research (CR) Online Course,https://www.udemy.com/course/clinical-research-cr-online-course/,Anuj Tripathi,4.3,36,1.5,7,Beginner,54.99,11.99,84
847,Conversational Japanese 日本語会話,https://www.udemy.com/course/conversational-japanese/,Luna W,4.2,36,30.0,5,Beginner,49.99,11.99,2893
848,Linear Algebra for Data Science & Machine Learning - 2020,https://www.udemy.com/course/linear-algebra-for-data-science-machine-learning/,Datai Team Academy,3.9,35,1.5,7,Beginner,129.99,11.99,3788
849,Create Certification Courses And Increase Course Enrollments,https://www.udemy.com/course/certification-courses/,Cha~zay Sandhriel Ph.D.,4.9,35,1.5,19,All Levels,129.99,11.99,249
850,A guide to teaching ESL: Young learners and above.,https://www.udemy.com/course/a-guide-to-teaching-esl-in-asia-young-learners-and-above/,Nikolas John Cakebread,4.7,35,2.0,9,Beginner,59.99,11.99,131
851,Basic Math For Welding And CWI Inspection Part 1,https://www.udemy.com/course/welding-and-cwi-inspection-basic-math/,Glen Lewis,4.1,35,40.0,17,Beginner,69.99,11.99,193
852,English Made Simple: Learn How To Use Conditionals,https://www.udemy.com/course/english-made-simple-learn-how-to-use-conditionals/,Fred Williams,4.0,35,41.0,10,Intermediate,19.99,11.99,2046
853,Prep for GRE® Subject Math Exam-Module6:Abstract Algebra,https://www.udemy.com/course/gre-subject-math-prep-module6abstract-algebra/,Gilad Pagi,4.7,35,1.0,8,Expert,0.0,34.99,345
854,Prep for GRE® Subject Math Exam-Module6:Abstract Algebra,https://www.udemy.com/course/gre-subject-math-prep-module6abstract-algebra/,Gilad Pagi,4.7,35,1.0,8,Expert,0.0,34.99,345
855,Spanish: Listening Comprehension,https://www.udemy.com/course/listen-and-write-spanish/,Maxi La Runa,4.8,35,1.5,8,Intermediate,19.99,11.99,2445
856,Basics of Patent Search,https://www.udemy.com/course/basics-of-patent-search/,Prabhakar Sharma,3.8,35,1.0,20,Beginner,19.99,11.99,141
857,Membrane Technologies Used in Water and Wastewater treatment,https://www.udemy.com/course/membrane-technologies-used-in-water-and-wastewater-treatment/,Sindhuja Krishnaa,4.1,35,2.5,6,All Levels,24.99,11.99,124
858,The Rhythm & Melody of American English - Part 2,https://www.udemy.com/course/the-rhythm-melody-of-american-english-part-2/,Nicole Kaup,4.8,35,2.0,15,Expert,59.99,11.99,343
859,TOEFL iBT Complete Speaking (26+) Course,https://www.udemy.com/course/toefl-ibt-complete-speaking-26-course/,"Keino Campbell, Esq.",3.9,35,11.5,61,Intermediate,29.99,11.99,4470
860,[**UPDATED**] OpenFOAM: From Modeling to Programming,https://www.udemy.com/course/openfoam-from-modelling-to-developing/,Ziad Baraka,3.1,35,3.0,46,Beginner,54.99,11.99,572
861,Discrete Mathematics: Open Doors to Great Careers 2,https://www.udemy.com/course/discrete-mathematics-open-doors-to-great-careers-2/,Richard Han,3.5,35,6.0,65,All Levels,19.99,11.99,1033
862,Study English Anywhere- English Language Advanced Course,https://www.udemy.com/course/study-english-anywhere-english-language-advanced-course/,Michael Sisley,4.2,35,2.5,19,Expert,39.99,11.99,1270
863,CBSE Math Class 10 (Follows Latest Syllabus of NCERT),https://www.udemy.com/course/cbse-math-class-10-follows-latest-syllabus-of-ncert/,LetsTute Make it Easy,3.9,35,17.5,121,Intermediate,19.99,11.99,1571
864,Get Rid of your Accent Part One,https://www.udemy.com/course/get-rid-of-your-accent/,Olga Smith Linda James,4.6,35,3.0,46,All Levels,99.99,11.99,214
865,Phase 1 Environmental Site Assessment: Real Case Study,https://www.udemy.com/course/phase-i-esa/,Bach Pham,4.5,35,8.5,102,All Levels,129.99,11.99,136
866,GRIFFIN SAT: A Complete Course On Acing the SAT,https://www.udemy.com/course/griffinsat/,Paul Griffin,4.1,35,6.0,26,All Levels,24.99,11.99,1045
867,Essential English Grammar | Important subjects in detail,https://www.udemy.com/course/essential-english-grammar-important-subjects-in-details/,Armin Doushabi,4.3,35,3.5,27,All Levels,19.99,11.99,81
868,English for Telephoning: How To Make and Take Phone Calls,https://www.udemy.com/course/english-telephone-skills/,Jacqueline Seidel,4.2,35,1.5,19,Beginner,39.99,11.99,351
869,Dominando el arte de la apertura de reuniones en inglés,https://www.udemy.com/course/apertura-de-reuniones-en-ingles/,Practica en la Ciudad,3.7,35,1.5,12,Intermediate,19.99,11.99,0
870,CSI Sap2000 3D building design + all type of (Stairs+Tanks),https://www.udemy.com/course/csi-sap2000-3d-building-design-all-type-of-stairstanks/,Ahmad Traboulsi,4.1,35,7.0,51,All Levels,0.0,0.0,3145
